{
  "schema_version": "1.0",
  "record_type": "EVIDENCE_PACK",
  "id": "EP-002",
  "title": "Career source closure versus executable readiness",
  "generated_at": "2026-10-22T22:00:00+08:00",
  "generation_mode": "CURATED_V1",
  "source_main_sha": "11f9eedd6bfcb05e5d0fcb2f17327bc3c288de86",
  "claim_ids": [
    "CL-006",
    "CL-007"
  ],
  "supporting_events": [
    "RM-2026-005",
    "RM-2026-006"
  ],
  "accepted_artifacts": [
    {
      "label": "Career blocker ontology backlog — 888 IDs and 513 outcome-mapping blockers",
      "url": "https://github.com/15937-ass/ziwei-state-space/blob/11f9eedd6bfcb05e5d0fcb2f17327bc3c288de86/knowledge/wp07c/CAREER_BLOCKER_ONTOLOGY_BACKLOG_v0.1.md",
      "authority_status": "ACCEPTED_MAIN",
      "repository_path": "knowledge/wp07c/CAREER_BLOCKER_ONTOLOGY_BACKLOG_v0.1.md",
      "blob_sha": "f9566ce907a1973864239511ab832a64429670ac"
    },
    {
      "label": "Career contextual activation closure v0.16",
      "url": "https://github.com/15937-ass/ziwei-state-space/blob/11f9eedd6bfcb05e5d0fcb2f17327bc3c288de86/knowledge/wp07c/CAREER_CONTEXTUAL_ACTIVATION_CLOSURE_251_v0.16.json",
      "authority_status": "ACCEPTED_MAIN",
      "repository_path": "knowledge/wp07c/CAREER_CONTEXTUAL_ACTIVATION_CLOSURE_251_v0.16.json",
      "blob_sha": "d413669303375d7fc36624c33fde9c02f6ae8306"
    },
    {
      "label": "Career response compatibility closure — 251/251",
      "url": "https://github.com/15937-ass/ziwei-state-space/blob/11f9eedd6bfcb05e5d0fcb2f17327bc3c288de86/knowledge/wp07c/CAREER_RESPONSE_COMPATIBILITY_CLOSURE_v0.1.json",
      "authority_status": "ACCEPTED_MAIN",
      "repository_path": "knowledge/wp07c/CAREER_RESPONSE_COMPATIBILITY_CLOSURE_v0.1.json",
      "blob_sha": "7759b636ddbd3fa8440e8506642061a389dd89b2"
    },
    {
      "label": "Career residual 28 final source-pass execution evidence",
      "url": "https://github.com/15937-ass/ziwei-state-space/blob/11f9eedd6bfcb05e5d0fcb2f17327bc3c288de86/validation/knowledge/issue_501_career_residual_28/EXECUTION_EVIDENCE.md",
      "authority_status": "ACCEPTED_MAIN",
      "repository_path": "validation/knowledge/issue_501_career_residual_28/EXECUTION_EVIDENCE.md",
      "blob_sha": "8ccd4a2d4c93f8aea3902048398b0b7de0a94810"
    },
    {
      "label": "Career compiler-readiness census — 26 candidates",
      "url": "https://github.com/15937-ass/ziwei-state-space/blob/11f9eedd6bfcb05e5d0fcb2f17327bc3c288de86/knowledge/wp08/CAREER_COMPILER_READINESS_CENSUS_26_v0.1.json",
      "authority_status": "ACCEPTED_MAIN",
      "repository_path": "knowledge/wp08/CAREER_COMPILER_READINESS_CENSUS_26_v0.1.json",
      "blob_sha": "71317dec9356b4b53601d123744c2f009af0e972"
    },
    {
      "label": "Career dependency condition IR — 3 records",
      "url": "https://github.com/15937-ass/ziwei-state-space/blob/11f9eedd6bfcb05e5d0fcb2f17327bc3c288de86/knowledge/wp08/CAREER_DEPENDENCY_IR_3_v0.1.json",
      "authority_status": "ACCEPTED_MAIN",
      "repository_path": "knowledge/wp08/CAREER_DEPENDENCY_IR_3_v0.1.json",
      "blob_sha": "c5df80d97148b00240d867712f9bb110d7d13e4c"
    },
    {
      "label": "Career direct condition IR — 9 records",
      "url": "https://github.com/15937-ass/ziwei-state-space/blob/11f9eedd6bfcb05e5d0fcb2f17327bc3c288de86/knowledge/wp08/CAREER_DIRECT_CONDITION_IR_9_v0.1.json",
      "authority_status": "ACCEPTED_MAIN",
      "repository_path": "knowledge/wp08/CAREER_DIRECT_CONDITION_IR_9_v0.1.json",
      "blob_sha": "27b1be88be82acca624cd9f52f079ce6df7d67d9"
    },
    {
      "label": "Response Semantics Product Adapter v0.2",
      "url": "https://github.com/15937-ass/ziwei-state-space/blob/11f9eedd6bfcb05e5d0fcb2f17327bc3c288de86/product/RESPONSE_SEMANTICS_ADAPTER_V0_2.md",
      "authority_status": "ACCEPTED_MAIN",
      "repository_path": "product/RESPONSE_SEMANTICS_ADAPTER_V0_2.md",
      "blob_sha": "b354f256f084cc5353be8827948fae3f246473fe"
    },
    {
      "label": "Response Semantics adapter readiness v0.3",
      "url": "https://github.com/15937-ass/ziwei-state-space/blob/11f9eedd6bfcb05e5d0fcb2f17327bc3c288de86/product/RESPONSE_SEMANTICS_ADAPTER_READINESS_v0.3.json",
      "authority_status": "ACCEPTED_MAIN",
      "repository_path": "product/RESPONSE_SEMANTICS_ADAPTER_READINESS_v0.3.json",
      "blob_sha": "a537ced6040dc2116cfc8ef274a0cc4b0292dba5"
    }
  ],
  "conflicts_and_limitations": [
    "The 888/888 Career structured-ID census and the 251-row contextual-activation closure are different populations.",
    "The 228/228 deep-source-review partition is within the 251-row closure, not a synonym for the 513 BLOCKED_OUTCOME_MAPPING count.",
    "The accepted readiness snapshot reports 12 Knowledge condition-IR-ready candidates, 14 row-local candidates not condition-IR-ready, 0 conditions compiled and 0 execution unlocked.",
    "This pack records the accepted repository baseline; it does not rerun tests or authorize Product runtime effects."
  ],
  "wording_ceiling": "Career has complete structured-ID disposition coverage and extensive source review, while substantial ontology/compiler blockers remain. The cited readiness baseline reports no Product condition compilation or runtime unlock.",
  "forbidden_inferences": [
    "888/888 structured IDs means 888 executable rules.",
    "228/228 deep source review means all 513 outcome-mapping blockers were resolved.",
    "A Knowledge condition IR is already compiled into Product runtime.",
    "Source fidelity or rule activation establishes real-world predictive accuracy.",
    "Group terms without source-supported quantifiers may be assigned global ANY/ALL defaults."
  ],
  "status": "REVIEWED"
}
